{
  "reason": "initial",
  "header_sha256": "0000000000000000000000000000000000000000000000000000000000000000",
  "system_sha256": "0000000000000000000000000000000000000000000000000000000000000000",
  "tools_sha256": "0000000000000000000000000000000000000000000000000000000000000000",
  "config_sha256": "0000000000000000000000000000000000000000000000000000000000000000",
  "agent_role": "main",
  "tools": [
    "read_file",
    "grep"
  ],
  "tool_count": 2
}
